Turkey at a Crossroads,Erdoğan Faces a Real Risk of Losing Election,12/05/2023 16:43:40
Deserting Putin,A Visit to the Soldiers Who Have Fled Russia's War,12/05/2023 16:43:40
A Wave of Repression,Tunisia's President Turns Back the Clock to Authoritarianism,12/05/2023 16:43:40
Health Care in Africa,Hospitals Experience Fringe Benefits of COVID Pandemic,12/05/2023 16:43:40
Malaria Breakthrough,New Vaccine Could Save Hundreds of Thousands of Children,12/05/2023 16:43:40
The Battle of the Generals,A Bloody Turn in Africa's Story of Hope,12/05/2023 16:43:40
A New Superpower?,India's Economic Rise Holds Promise for the Country and Beyond,12/05/2023 16:43:40
Kidnapping as a Weapon of War,The Abducted Children of Ukraine,12/05/2023 16:43:40
Former Pakistani Prime Minister Khan,“My Opponents Will Try To Assassinate Me Again”,12/05/2023 16:43:40
Analyst on Tehran's Nuclear Game,What Iran Wants for a New Deal,12/05/2023 16:43:40
Ethiopia After the Civil War,A Fragile Peace in the Wake of Unspeakable Horrors,12/05/2023 16:43:40
"The ""Vulkan Files""",A Look Inside Putin's Secret Plans for Cyber-Warfare,12/05/2023 16:43:40
The Search for the Origins of SARS-CoV-2,"""The Results on My Screen Were: Raccoon Dog, Raccoon Dog, Raccoon Dog!""",12/05/2023 16:43:40
The Unwanted,Georgians Don't Always Roll Out Welcome Mat for Russian Exiles,12/05/2023 16:43:40
Debt Forgiveness for Cape Verde,A Climate Deal that Could Become a Model for Others,12/05/2023 16:43:40
Acrylic Paints and Urban Combat,The Chechens Fighting on the Ukrainian Side,12/05/2023 16:43:40
Germany's Migration About-Face,Berlin Seeks to Recruit Skilled Labor from Africa,12/05/2023 16:43:40
Russia's Dark Shadow,The Black Sea Region Is Suddenly Cast in Geopolitical Spotlight,12/05/2023 16:43:40
Moscow Mole,The Story Behind Germany's Embarrassing Intelligence Leak,12/05/2023 16:43:40
What the Future Might Hold for Asia,"""Every Time China Has Been United, It Has Dominated""",08/06/2023 16:30:24
The Pain of War,The Families of Dead Wagner Fighters Speak Out,08/06/2023 16:30:24
Shadows of World War II,A New Look at the Great Quedlinburg Art Robbery,08/06/2023 16:30:24
"""Systemically Excluded""",The Women of Sierra Leone Have New Land-Ownership Rights,08/06/2023 16:30:24
Interview with Jordanian Foreign Minister Safadi,"""Russia in Syria Is a Stabilizing Factor Compared To the Alternative""",08/06/2023 16:30:24
Yevgeny Prigozhin's Meat Grinder,A Moment of Truth for Russia's Wagner Group in Bakhmut,08/06/2023 16:30:24
A Journey Through China's Uyghur Region,The Three Worlds of Xinjiang,08/06/2023 16:30:24
Operation Counterstrike,What Might the Approaching Ukrainian Offensive Achieve?,08/06/2023 16:30:24
Turkey at a Crossroads,Erdoğan Faces a Real Risk of Losing Election,08/06/2023 16:30:24
Deserting Putin,A Visit to the Soldiers Who Have Fled Russia's War,08/06/2023 16:30:24
A Wave of Repression,Tunisia's President Turns Back the Clock to Authoritarianism,08/06/2023 16:30:24
Health Care in Africa,Hospitals Experience Fringe Benefits of COVID Pandemic,08/06/2023 16:30:24
Malaria Breakthrough,New Vaccine Could Save Hundreds of Thousands of Children,08/06/2023 16:30:24
The Battle of the Generals,A Bloody Turn in Africa's Story of Hope,08/06/2023 16:30:24
A New Superpower?,India's Economic Rise Holds Promise for the Country and Beyond,08/06/2023 16:30:24
Kidnapping as a Weapon of War,The Abducted Children of Ukraine,08/06/2023 16:30:24
Former Pakistani Prime Minister Khan,“My Opponents Will Try To Assassinate Me Again”,08/06/2023 16:30:24
Analyst on Tehran's Nuclear Game,What Iran Wants for a New Deal,08/06/2023 16:30:24
Ethiopia After the Civil War,A Fragile Peace in the Wake of Unspeakable Horrors,08/06/2023 16:30:24
